Title,Start Time,End Time,Date,Location,Department,Site
Irrigation and the Spatial Pattern of Local Economic Development in India,,,,,Politics,https://politics.virginia.edu/frontiers-global-development
Randomized Regulation: The Impact of Minimum Quality Standards on Health Markets,,,,,Politics,https://politics.virginia.edu/frontiers-global-development
Hollowing out the State,,,,,Politics,https://politics.virginia.edu/frontiers-global-development
Tools for Teaching: Leveraging Technology to Improve Classroom Content Delivery,,,,,Politics,https://politics.virginia.edu/frontiers-global-development
"Seasonal liquidity, rural labor markets, and agricultural production: Evidence from Zambia",,,,,Politics,https://politics.virginia.edu/frontiers-global-development
Pushing crime around the corner? Estimating experimental impacts of large-scale security interventions,,,,,Politics,https://politics.virginia.edu/frontiers-global-development
"Internal Conflict, Elite Action, and State Failure: Evidence from China, 1000-1911",,,,,Politics,https://politics.virginia.edu/frontiers-global-development
Political Leadership and Sovereign Debt Ratings,,,,,Politics,https://politics.virginia.edu/frontiers-global-development
"Marriage, Commitment and Unbundling Gendered Norms",,,,,Politics,https://politics.virginia.edu/frontiers-global-development
"Women, Power, and Property: The Paradox of Gender Equality Laws in India",,,,,Politics,https://politics.virginia.edu/frontiers-global-development
Building Trust in Government: The Opportunities and Challenges of Adverse Shocks,,,,,Politics,https://politics.virginia.edu/frontiers-global-development
Misconduct and Reputation under Imperfect Information,,,,,Politics,https://politics.virginia.edu/frontiers-global-development
In Utero Exposure to Industrial Disasters: A Case Study of the Bhopal Gas Tragedy,,,,,Politics,https://politics.virginia.edu/frontiers-global-development
The Cyclical Electoral Impacts of Programmatic Policies: Evidence From Education Reforms in Tanzania,,,,,Politics,https://politics.virginia.edu/frontiers-global-development
How Do Workers and Firms Search and Match in Low-income Labour Markets? Evidence from a Six-Year Labor Market Experiment in Uganda,,,,,Politics,https://politics.virginia.edu/frontiers-global-development
"Investing in influence: Investors, portfolio firms, and political giving",,,,,Politics,https://politics.virginia.edu/frontiers-global-development
Upcoming Talk by,,,,,Politics,https://politics.virginia.edu/frontiers-global-development
Expanding Financial Access Via Credit Cards: Evidence from Mexico,,,,,Politics,https://politics.virginia.edu/frontiers-global-development
Citizen Participation and Government Accountability: National-Scale Experimental Evidence from Pollution Appeals in China,,,,,Politics,https://politics.virginia.edu/frontiers-global-development
"Aggregate Shocks, Domestic Trade Collapse and Regional Realignment",,,,,Politics,https://politics.virginia.edu/frontiers-global-development
Organizational Capacity and Profit Shifting,,,,,Politics,https://politics.virginia.edu/frontiers-global-development
Unshrouding product-specific attributes through financial education,,,,,Politics,https://politics.virginia.edu/frontiers-global-development
From Pluribus to Unum? The Civil War and Imagined Sovereignty in 19th Century America,,,,,Politics,https://politics.virginia.edu/frontiers-global-development
"Internet, Social Media, and the Behavior of Politicians: Evidence from Facebook in Brazil",,,,,Politics,https://politics.virginia.edu/frontiers-global-development
No Country for Dying Firms: Evidence from India,,,,,Politics,https://politics.virginia.edu/frontiers-global-development
Irrigation and the Spatial Pattern of Local Economic Development in India,,,,,Politics,https://politics.virginia.edu/frontiers-global-development
Randomized Regulation: The Impact of Minimum Quality Standards on Health Markets,,,,,Politics,https://politics.virginia.edu/frontiers-global-development
Hollowing out the State,,,,,Politics,https://politics.virginia.edu/frontiers-global-development
Tools for Teaching: Leveraging Technology to Improve Classroom Content Delivery,,,,,Politics,https://politics.virginia.edu/frontiers-global-development
"Seasonal liquidity, rural labor markets, and agricultural production: Evidence from Zambia",,,,,Politics,https://politics.virginia.edu/frontiers-global-development
Pushing crime around the corner? Estimating experimental impacts of large-scale security interventions,,,,,Politics,https://politics.virginia.edu/frontiers-global-development
"Internal Conflict, Elite Action, and State Failure: Evidence from China, 1000-1911",,,,,Politics,https://politics.virginia.edu/frontiers-global-development
Political Leadership and Sovereign Debt Ratings,,,,,Politics,https://politics.virginia.edu/frontiers-global-development
"Marriage, Commitment and Unbundling Gendered Norms",,,,,Politics,https://politics.virginia.edu/frontiers-global-development
"Women, Power, and Property: The Paradox of Gender Equality Laws in India",,,,,Politics,https://politics.virginia.edu/frontiers-global-development
Building Trust in Government: The Opportunities and Challenges of Adverse Shocks,,,,,Politics,https://politics.virginia.edu/frontiers-global-development
Misconduct and Reputation under Imperfect Information,,,,,Politics,https://politics.virginia.edu/frontiers-global-development
In Utero Exposure to Industrial Disasters: A Case Study of the Bhopal Gas Tragedy,,,,,Politics,https://politics.virginia.edu/frontiers-global-development
The Cyclical Electoral Impacts of Programmatic Policies: Evidence From Education Reforms in Tanzania,,,,,Politics,https://politics.virginia.edu/frontiers-global-development
How Do Workers and Firms Search and Match in Low-income Labour Markets? Evidence from a Six-Year Labor Market Experiment in Uganda,,,,,Politics,https://politics.virginia.edu/frontiers-global-development
"Investing in influence: Investors, portfolio firms, and political giving",,,,,Politics,https://politics.virginia.edu/frontiers-global-development
Upcoming Talk by,,,,,Politics,https://politics.virginia.edu/frontiers-global-development
Expanding Financial Access Via Credit Cards: Evidence from Mexico,,,,,Politics,https://politics.virginia.edu/frontiers-global-development
Citizen Participation and Government Accountability: National-Scale Experimental Evidence from Pollution Appeals in China,,,,,Politics,https://politics.virginia.edu/frontiers-global-development
May the 4th,,,2024-05-03,,Scholars' Lab,https://scholarslab.lib.virginia.edu/events/
Mother's Day,,,2024-05-06,,Scholars' Lab,https://scholarslab.lib.virginia.edu/events/
Environmental Justice Documentary Screening,,,2024-04-19,Newcomb Hall (Student Center),University of Virginia,https://www.virginia.edu/calendar
EHD Undergraduate Graduation Celebration,,,2024-05-01,Student Affairs,School of Education and Human Development,https://education.virginia.edu/events
UVA Club of Washington DC: UVA Graduate School Fair,,,2024-05-08,,School of Education and Human Development,https://education.virginia.edu/events
Global Futures Symposium,,,2024-04-25,,UVA Global,https://global.virginia.edu/events
2024 People Power Academy,,,2024-04-26,,UVA Global,https://global.virginia.edu/events
"BME Seminar: John Platig, Ph.D., University of Virginia",,,2024-04-26,MR5 1041,School of Engineering and Applied Science,https://engineering.virginia.edu/news-events/events
ECE Seminar: Speaker: Dr. Rounak Meyur,,,2024-04-26,THORNTON HALL ROOM E316,School of Engineering and Applied Science,https://engineering.virginia.edu/news-events/events
Celebrating 50 Years of Corrosion and Electrochemistry Research at UVA,,,2024-06-01,Ern Commons,School of Engineering and Applied Science,https://engineering.virginia.edu/news-events/events
M.S. in Commerce Information Session,,,2024-04-23,,McIntire School of Commerce,https://commcal.mcintire.virginia.edu/
Alternative Investing in a Rapidly Changing Environment  McIntire Alumni Panel,,,2024-04-25,,McIntire School of Commerce,https://commcal.mcintire.virginia.edu/
Connaughton Speaker Series: A Founders Conversation,,,2024-04-26,,McIntire School of Commerce,https://commcal.mcintire.virginia.edu/
NYC Alumni & Friends Reception,,,2024-05-07,,McIntire School of Commerce,https://commcal.mcintire.virginia.edu/
Knowledge Continuum,,,2024-05-10,,McIntire School of Commerce,https://commcal.mcintire.virginia.edu/
M.S. in Accounting Information Session,,,2024-05-14,,McIntire School of Commerce,https://commcal.mcintire.virginia.edu/
London Pub Night with Carl Zeithaml,,,2024-05-30,,McIntire School of Commerce,https://commcal.mcintire.virginia.edu/
"Reunions Weekend Lunch: Classes of '94, '89, '84, '79, '74, TJ Society",,,2024-06-01,,McIntire School of Commerce,https://commcal.mcintire.virginia.edu/
"Reunions Weekend Lunch: Classes of '19, '14, '09, '04, '99",,,2024-06-08,,McIntire School of Commerce,https://commcal.mcintire.virginia.edu/
A Conversation on Capitalism & Democracy,,,2024-06-19,,McIntire School of Commerce,https://commcal.mcintire.virginia.edu/
Modern & Contemporary Workshop with Marcel Schmid,,,2024-04-20,New Cabell Hall 236,Institue of Humanities and Global Culture,https://ihgc.as.virginia.edu/events
RED Lecture with J Kameron Carter,,,2024-04-22,,Religious Studies,https://religiousstudies.as.virginia.edu/events
